{\rtf1\ansi\ansicpg1252\cocoartf2759
\cocoatextscaling0\cocoaplatform0{\fonttbl\f0\fnil\fcharset0 Menlo-Regular;}
{\colortbl;\red255\green255\blue255;\red0\green0\blue0;}
{\*\expandedcolortbl;;\csgray\c0;}
\margl1440\margr1440\vieww11520\viewh8400\viewkind0
\pard\tx560\tx1120\tx1680\tx2240\tx2800\tx3360\tx3920\tx4480\tx5040\tx5600\tx6160\tx6720\pardirnatural\partightenfactor0

\f0\fs22 \cf2 \CocoaLigature0 sudo tcpdump -A -i en0\
\
tcpdump: verbose output suppressed, use -v[v]... for full protocol decode\
listening on en0, link-type EN10MB (Ethernet), snapshot length 524288 bytes\
19:51:14.803554 ARP, Request who-has 192.168.0.128 tell 192.168.0.1, length 46\
.........,mh.=................................\
19:51:14.803556 ARP, Request who-has 192.168.0.129 tell 192.168.0.1, length 46\
.........,mh.=................................\
19:51:14.803557 ARP, Request who-has 192.168.0.130 tell 192.168.0.1, length 46\
.........,mh.=................................\
19:51:14.803557 ARP, Request who-has 192.168.0.131 tell 192.168.0.1, length 46\
.........,mh.=................................\
19:51:14.803558 ARP, Request who-has 192.168.0.132 tell 192.168.0.1, length 46\
.........,mh.=................................\
19:51:14.803559 ARP, Request who-has 192.168.0.133 tell 192.168.0.1, length 46\
.........,mh.=................................\
19:51:14.803560 ARP, Request who-has 192.168.0.134 tell 192.168.0.1, length 46\
.........,mh.=................................\
19:51:14.803560 ARP, Request who-has 192.168.0.135 tell 192.168.0.1, length 46\
.........,mh.=................................\
19:51:14.804230 ARP, Request who-has 192.168.0.136 tell 192.168.0.1, length 46\
.........,mh.=................................\
19:51:14.804824 ARP, Request who-has 192.168.0.137 tell 192.168.0.1, length 46\
.........,mh.=................................\
19:51:14.804826 ARP, Request who-has 192.168.0.138 tell 192.168.0.1, length 46\
.........,mh.=................................\
19:51:14.804826 ARP, Request who-has 192.168.0.139 tell 192.168.0.1, length 46\
.........,mh.=................................\
19:51:14.804827 ARP, Request who-has 192.168.0.140 tell 192.168.0.1, length 46\
.........,mh.=................................\
19:51:14.804828 ARP, Request who-has 192.168.0.141 tell 192.168.0.1, length 46\
.........,mh.=................................\
19:51:14.805067 ARP, Request who-has 192.168.0.142 tell 192.168.0.1, length 46\
.........,mh.=................................\
19:51:14.805068 ARP, Request who-has 192.168.0.143 tell 192.168.0.1, length 46\
.........,mh.=................................\
19:51:14.806073 ARP, Request who-has 192.168.0.144 tell 192.168.0.1, length 46\
.........,mh.=................................\
19:51:14.806075 ARP, Request who-has 192.168.0.145 tell 192.168.0.1, length 46\
.........,mh.=................................\
19:51:14.806076 ARP, Request who-has 192.168.0.146 tell 192.168.0.1, length 46\
.........,mh.=................................\
19:51:14.806076 ARP, Request who-has 192.168.0.147 tell 192.168.0.1, length 46\
.........,mh.=................................\
19:51:14.806077 ARP, Request who-has 192.168.0.148 tell 192.168.0.1, length 46\
.........,mh.=................................\
19:51:14.806351 ARP, Request who-has 192.168.0.149 tell 192.168.0.1, length 46\
.........,mh.=................................\
19:51:14.806352 ARP, Request who-has 192.168.0.150 tell 192.168.0.1, length 46\
.........,mh.=................................\
19:51:14.806928 ARP, Request who-has 192.168.0.151 tell 192.168.0.1, length 46\
.........,mh.=................................\
19:51:14.806930 ARP, Request who-has 192.168.0.152 tell 192.168.0.1, length 46\
.........,mh.=................................\
19:51:14.806931 ARP, Request who-has 192.168.0.153 tell 192.168.0.1, length 46\
.........,mh.=................................\
19:51:14.807144 ARP, Request who-has 192.168.0.154 tell 192.168.0.1, length 46\
.........,mh.=................................\
19:51:14.807145 ARP, Request who-has 192.168.0.155 tell 192.168.0.1, length 46\
.........,mh.=................................\
19:51:14.807983 ARP, Request who-has 192.168.0.156 tell 192.168.0.1, length 46\
.........,mh.=................................\
19:51:14.807984 ARP, Request who-has 192.168.0.157 tell 192.168.0.1, length 46\
.........,mh.=................................\
19:51:14.807985 ARP, Request who-has 192.168.0.158 tell 192.168.0.1, length 46\
.........,mh.=................................\
19:51:14.807986 ARP, Request who-has 192.168.0.159 tell 192.168.0.1, length 46\
.........,mh.=................................\
19:51:14.807987 ARP, Request who-has 192.168.0.160 tell 192.168.0.1, length 46\
.........,mh.=................................\
19:51:14.808374 ARP, Request who-has 192.168.0.161 tell 192.168.0.1, length 46\
.........,mh.=................................\
19:51:14.808375 ARP, Request who-has 192.168.0.162 tell 192.168.0.1, length 46\
.........,mh.=................................\
19:51:14.809208 ARP, Request who-has 192.168.0.163 tell 192.168.0.1, length 46\
.........,mh.=................................\
19:51:14.809209 ARP, Request who-has 192.168.0.164 tell 192.168.0.1, length 46\
.........,mh.=................................\
19:51:14.809210 ARP, Request who-has 192.168.0.165 tell 192.168.0.1, length 46\
.........,mh.=................................\
19:51:14.809212 ARP, Request who-has 192.168.0.166 tell 192.168.0.1, length 46\
.........,mh.=................................\
19:51:14.809214 ARP, Request who-has 192.168.0.167 tell 192.168.0.1, length 46\
.........,mh.=................................\
19:51:14.810271 ARP, Request who-has 192.168.0.168 tell 192.168.0.1, length 46\
.........,mh.=................................\
19:51:14.810272 ARP, Request who-has 192.168.0.169 tell 192.168.0.1, length 46\
.........,mh.=................................\
19:51:14.810273 ARP, Request who-has 192.168.0.170 tell 192.168.0.1, length 46\
.........,mh.=................................\
19:51:14.810273 ARP, Request who-has 192.168.0.171 tell 192.168.0.1, length 46\
.........,mh.=................................\
19:51:14.810274 ARP, Request who-has 192.168.0.172 tell 192.168.0.1, length 46\
.........,mh.=................................\
19:51:14.810275 ARP, Request who-has 192.168.0.173 tell 192.168.0.1, length 46\
.........,mh.=................................\
19:51:14.810809 ARP, Request who-has 192.168.0.174 tell 192.168.0.1, length 46\
.........,mh.=................................\
19:51:14.810811 ARP, Request who-has 192.168.0.175 tell 192.168.0.1, length 46\
.........,mh.=................................\
19:51:14.811099 ARP, Request who-has 192.168.0.176 tell 192.168.0.1, length 46\
.........,mh.=................................\
19:51:14.811101 ARP, Request who-has 192.168.0.177 tell 192.168.0.1, length 46\
.........,mh.=................................\
19:51:14.811102 ARP, Request who-has 192.168.0.178 tell 192.168.0.1, length 46\
.........,mh.=................................\
19:51:14.811609 ARP, Request who-has 192.168.0.179 tell 192.168.0.1, length 46\
.........,mh.=................................\
19:51:14.811610 ARP, Request who-has 192.168.0.180 tell 192.168.0.1, length 46\
.........,mh.=................................\
19:51:14.811968 ARP, Request who-has 192.168.0.181 tell 192.168.0.1, length 46\
.........,mh.=................................\
19:51:14.811969 ARP, Request who-has 192.168.0.182 tell 192.168.0.1, length 46\
.........,mh.=................................\
19:51:14.811970 ARP, Request who-has 192.168.0.183 tell 192.168.0.1, length 46\
.........,mh.=................................\
19:51:14.813021 ARP, Request who-has 192.168.0.184 tell 192.168.0.1, length 46\
.........,mh.=................................\
19:51:14.813022 ARP, Request who-has 192.168.0.185 tell 192.168.0.1, length 46\
.........,mh.=................................\
19:51:14.813023 ARP, Request who-has 192.168.0.186 tell 192.168.0.1, length 46\
.........,mh.=................................\
19:51:14.813023 ARP, Request who-has 192.168.0.187 tell 192.168.0.1, length 46\
.........,mh.=................................\
19:51:14.813024 ARP, Request who-has 192.168.0.188 tell 192.168.0.1, length 46\
.........,mh.=................................\
19:51:14.813025 ARP, Request who-has 192.168.0.189 tell 192.168.0.1, length 46\
.........,mh.=................................\
19:51:14.813517 ARP, Request who-has 192.168.0.190 tell 192.168.0.1, length 46\
.........,mh.=................................\
19:51:14.813518 ARP, Request who-has 192.168.0.191 tell 192.168.0.1, length 46\
.........,mh.=................................\
19:51:15.366949 IP 192.168.0.23.54770 > a23-223-17-202.deploy.static.akamaitechnologies.com.https: Flags [P.], seq 2693150377:2693150999, ack 2728911521, win 15758, options [nop,nop,TS val 375923992 ecr 1554986987], length 622\
E.....@.@.M...............6.......=..`.....\
.h%.\\.7.....i..3....M..... =S.$..Z.%."B.>C.T.a.D>..x..r..M..._g.m.K.	....f"..,_^6r.I.........r...`.'..............|..3..3.......%...+H.*..fz...m!;..r.Q..'F.w..........\
n.6.....K.R.V..y.6..Z/.....kZ.-%. .....f.\
[...oU.....$.)..|K.%1..q_G.z^.^..YeEf...=.o......-i.$T.S.........i....h]..x.Yh......j...(...t\
\}:;. .....0.<.......m..\
...\}d.......ZE.c3.@...l.p.t..$E.&..h...wD..........%..J..JG.......7..HA.eBK....9u...&R.B..0,..0..i...(..w.>..)"6...N%.....!..L..\
...\{w......`	uJ&".i..\\4..]zP:2x..f\\.>.\}..=Wz...u..N..:O.....nO......7.+...*......;p.......5iU..	.f.p,./.y..>I..Bw...,9q...+.5...I.X9?u..g.2...ri..xD...C.WX...._.P9.....~..N.\
19:51:15.388176 IP 192.168.0.23.54770 > a23-223-17-202.deploy.static.akamaitechnologies.com.https: Flags [.], ack 1, win 15758, length 0\
E..(j...@.%...............6.....P.=.S...\
19:51:15.389421 IP a23-223-17-202.deploy.static.akamaitechnologies.com.https > 192.168.0.23.54770: Flags [.], seq 1:1449, ack 622, win 501, options [nop,nop,TS val 1554997005 ecr 375923992], length 1448\
E...W.@.8.....................9.....%,.....\
\\._..h%....@.)H..|...h.i.>...H...3..+.l."g....'..5.(..M.!...........`..*.A......+.`...p\{..Rc......F...O...c..	W.3......euFdr..w.[+r#.nR.c........W....DW..R.....u.z...]LeC.3wp.e.7....x..mi...O\}(ih~....%8\{64..k..D.E. K..s.C....~._..|.d......uM...&[.lJ..Z.K.o\{.....8.....	h.....`.s..N..,>.g..F$G.`..X..4...\{....4.5...3/.=..k.d3t......	...Z...*..P......R....?..-........;vr.Me.R..5%..'F...W........c4....\{g.>2%..:/5.k@ ..........(...k9...E5.......]....Y...=..h. z=...W.......t.J.\
yU1.._...X..?...\{..WZ.\\...\
.l..S....(Zn...S..]).....w.UxR>fD...'...p]FC......8......B../X..d....eZk...+.z\}.$.E.1<.....3.jS../.H.Vn..L.........K&#\{...1.7\\..3.(\
...y........g.pk7x...V.v.2\{....B'.h.........re...04.!.f..x._.~\{..3\{P/d.)......D.._....,`Ay.]Y/=.....v.....D..:d.Ja.n........p.=..V\
Fg....Iy.cZ.[=y.d.~..."...R.-QXO\
.\
).....0..#...X..%..@....a\{..5..Z...].e...9...8..A7..._..Gj\\?.c..J.]/B.M.n.`Ls....-......c..).V......g..[.5]...o......d.2./.2....!O`.r...c.....B$U./........`."Dt.9..k.?R....4..................R.J.u..n..M..p`........7......W....z.].|.(1."..14&w.h...../..$.I.,SfB.....i.<x..zu0,...G..Z@.+.\}....>....1....Yqi..x5.O.D... .-\}..c+.t2.y..4..f_.p..Y..S..G..+..y...yu`..X.#.J......B..Hr.....GZI..>.........&T.i.....9..U...._.,.c	.xn.zp(&.u3..LUq_m\}=	.e..t...x....G...d....fK.....W.....24Fo.7"......v....k..H1\\	........qV..cQ......\}...........@.ls|..J..5E.......&x.l.K?B...!KN.lyj.|H.4........Y.Bm.5........b\\H.....<...c......w.2.......zr'..M....]n.F....p.......\
J..\
19:51:15.389423 IP a23-223-17-202.deploy.static.akamaitechnologies.com.https > 192.168.0.23.54770: Flags [.], seq 1449:2897, ack 622, win 501, options [nop,nop,TS val 1554997005 ecr 375923992], length 1448\
E...W.@.8..................I..9............\
\\._..h%..yo>If!..b.4U.Xg-.....A...............o}