{\rtf1\ansi\ansicpg1252\cocoartf2759
\cocoatextscaling0\cocoaplatform0{\fonttbl\f0\fnil\fcharset0 Menlo-Regular;}
{\colortbl;\red255\green255\blue255;\red0\green0\blue0;}
{\*\expandedcolortbl;;\csgray\c0;}
\margl1440\margr1440\vieww11520\viewh8400\viewkind0
\pard\tx560\tx1120\tx1680\tx2240\tx2800\tx3360\tx3920\tx4480\tx5040\tx5600\tx6160\tx6720\pardirnatural\partightenfactor0

\f0\fs22 \cf2 \CocoaLigature0 Last login: Sat Apr 13 14:15:02 on ttys000\
/Users/samuelkambaji/.zshrc:25: unmatched "\
samuelkambaji@Samuels-MacBook-Pro-2 ~ % apt=get install tcpdump\
usage: install [-bCcpSsv] [-B suffix] [-f flags] [-g group] [-m mode]\
               [-o owner] file1 file2\
       install [-bCcpSsv] [-B suffix] [-f flags] [-g group] [-m mode]\
               [-o owner] file1 ... fileN directory\
       install -d [-v] [-g group] [-m mode] [-o owner] directory ...\
samuelkambaji@Samuels-MacBook-Pro-2 ~ % tcpdump -i eth0\
tcpdump: eth0: No such device exists\
(No such device exists)\
samuelkambaji@Samuels-MacBook-Pro-2 ~ % sudo tcpdump -i en0\
\
Password:\
tcpdump: verbose output suppressed, use -v[v]... for full protocol decode\
listening on en0, link-type EN10MB (Ethernet), snapshot length 524288 bytes\
19:41:36.962560 IP 192.168.0.23.54770 > a23-223-17-202.deploy.static.akamaitechnologies.com.https: Flags [P.], seq 2693111867:2693112489, ack 2709897129, win 15758, options [nop,nop,TS val 375345589 ecr 1554408781], length 622\
19:41:36.976713 IP a23-223-17-202.deploy.static.akamaitechnologies.com.https > 192.168.0.23.54770: Flags [P.], seq 1:582, ack 622, win 501, options [nop,nop,TS val 1554418581 ecr 375345589], length 581\
19:41:36.976716 IP a23-223-17-202.deploy.static.akamaitechnologies.com.https > 192.168.0.23.54770: Flags [.], seq 582:2030, ack 622, win 501, options [nop,nop,TS val 1554418581 ecr 375345589], length 1448\
19:41:36.976718 IP a23-223-17-202.deploy.static.akamaitechnologies.com.https > 192.168.0.23.54770: Flags [.], seq 2030:3478, ack 622, win 501, options [nop,nop,TS val 1554418581 ecr 375345589], length 1448\
19:41:36.976844 IP 192.168.0.23.54770 > a23-223-17-202.deploy.static.akamaitechnologies.com.https: Flags [.], ack 3478, win 15704, options [nop,nop,TS val 375345603 ecr 1554418581], length 0\
19:41:36.977183 IP 192.168.0.23.54770 > a23-223-17-202.deploy.static.akamaitechnologies.com.https: Flags [.], ack 3478, win 15758, options [nop,nop,TS val 375345603 ecr 1554418581], length 0\
19:41:36.977725 IP a23-223-17-202.deploy.static.akamaitechnologies.com.https > 192.168.0.23.54770: Flags [.], seq 3478:4926, ack 622, win 501, options [nop,nop,TS val 1554418581 ecr 375345589], length 1448\
19:41:36.977727 IP a23-223-17-202.deploy.static.akamaitechnologies.com.https > 192.168.0.23.54770: Flags [.], seq 4926:6374, ack 622, win 501, options [nop,nop,TS val 1554418581 ecr 375345589], length 1448\
19:41:36.977728 IP a23-223-17-202.deploy.static.akamaitechnologies.com.https > 192.168.0.23.54770: Flags [.], seq 6374:7822, ack 622, win 501, options [nop,nop,TS val 1554418581 ecr 375345589], length 1448\
19:41:36.977791 IP 192.168.0.23.54770 > a23-223-17-202.deploy.static.akamaitechnologies.com.https: Flags [.], ack 7822, win 15690, options [nop,nop,TS val 375345603 ecr 1554418581], length 0\
19:41:36.977939 IP 192.168.0.23.54770 > a23-223-17-202.deploy.static.akamaitechnologies.com.https: Flags [.], ack 7822, win 15758, options [nop,nop,TS val 375345604 ecr 1554418581], length 0\
19:41:36.978818 IP a23-223-17-202.deploy.static.akamaitechnologies.com.https > 192.168.0.23.54770: Flags [.], seq 7822:9270, ack 622, win 501, options [nop,nop,TS val 1554418581 ecr 375345589], length 1448\
19:41:36.978820 IP a23-223-17-202.deploy.static.akamaitechnologies.com.https > 192.168.0.23.54770: Flags [.], seq 9270:10718, ack 622, win 501, options [nop,nop,TS val 1554418581 ecr 375345589], length 1448\
19:41:36.978821 IP a23-223-17-202.deploy.static.akamaitechnologies.com.https > 192.168.0.23.54770: Flags [.], seq 10718:12166, ack 622, win 501, options [nop,nop,TS val 1554418581 ecr 375345589], length 1448\
19:41:36.978822 IP a23-223-17-202.deploy.static.akamaitechnologies.com.https > 192.168.0.23.54770: Flags [.], seq 12166:13614, ack 622, win 501, options [nop,nop,TS val 1554418581 ecr 375345589], length 1448\
19:41:36.978823 IP a23-223-17-202.deploy.static.akamaitechnologies.com.https > 192.168.0.23.54770: Flags [.], seq 13614:15062, ack 622, win 501, options [nop,nop,TS val 1554418581 ecr 375345589], length 1448\
19:41:36.978824 IP a23-223-17-202.deploy.static.akamaitechnologies.com.https > 192.168.0.23.54770: Flags [.], seq 15062:16510, ack 622, win 501, options [nop,nop,TS val 1554418581 ecr 375345589], length 1448\
19:41:36.978825 IP a23-223-17-202.deploy.static.akamaitechnologies.com.https > 192.168.0.23.54770: Flags [P.], seq 16510:16988, ack 622, win 501, options [nop,nop,TS val 1554418581 ecr 375345589], length 478\
19:41:36.978826 IP a23-223-17-202.deploy.static.akamaitechnologies.com.https > 192.168.0.23.54770: Flags [.], seq 16988:18436, ack 622, win 501, options [nop,nop,TS val 1554418581 ecr 375345589], length 1448\
19:41:36.978827 IP a23-223-17-202.deploy.static.akamaitechnologies.com.https > 192.168.0.23.54770: Flags [.], seq 18436:19884, ack 622, win 501, options [nop,nop,TS val 1554418581 ecr 375345589], length 1448\
19:41:36.978828 IP a23-223-17-202.deploy.static.akamaitechnologies.com.https > 192.168.0.23.54770: Flags [.], seq 19884:21332, ack 622, win 501, options [nop,nop,TS val 1554418581 ecr 375345589], length 1448\
19:41:36.978829 IP a23-223-17-202.deploy.static.akamaitechnologies.com.https > 192.168.0.23.54770: Flags [.], seq 21332:22780, ack 622, win 501, options [nop,nop,TS val 1554418581 ecr 375345589], length 1448\
19:41:36.978831 IP a23-223-17-202.deploy.static.akamaitechnologies.com.https > 192.168.0.23.54770: Flags [.], seq 22780:24228, ack 622, win 501, options [nop,nop,TS val 1554418581 ecr 375345589], length 1448\
19:41:36.978832 IP a23-223-17-202.deploy.static.akamaitechnologies.com.https > 192.168.0.23.54770: Flags [.], seq 24228:25676, ack 622, win 501, options [nop,nop,TS val 1554418581 ecr 375345589], length 1448\
19:41:36.978833 IP a23-223-17-202.deploy.static.akamaitechnologies.com.https > 192.168.0.23.54770: Flags [.], seq 25676:27124, ack 622, win 501, options [nop,nop,TS val 1554418581 ecr 375345589], length 1448\
19:41:36.978959 IP 192.168.0.23.54770 > a23-223-17-202.deploy.static.akamaitechnologies.com.https: Flags [.], ack 27124, win 15457, options [nop,nop,TS val 375345604 ecr 1554418581], length 0\
19:41:36.979133 IP 192.168.0.23.54770 > a23-223-17-202.deploy.static.akamaitechnologies.com.https: Flags [.], ack 27124, win 15758, options [nop,nop,TS val 375345605 ecr 1554418581], length 0\
19:41:36.980187 IP a23-223-17-202.deploy.static.akamaitechnologies.com.https > 192.168.0.23.54770: Flags [.], seq 27124:28572, ack 622, win 501, options [nop,nop,TS val 1554418581 ecr 375345589], length 1448\
19:41:36.980189 IP a23-223-17-202.deploy.static.akamaitechnologies.com.https > 192.168.0.23.54770: Flags [.], seq 28572:30020, ack 622, win 501, options [nop,nop,TS val 1554418581 ecr 375345589], length 1448\
19:41:36.980190 IP a23-223-17-202.deploy.static.akamaitechnologies.com.https > 192.168.0.23.54770: Flags [.], seq 30020:31468, ack 622, win 501, options [nop,nop,TS val 1554418581 ecr 375345589], length 1448\
19:41:36.980192 IP a23-223-17-202.deploy.static.akamaitechnologies.com.https > 192.168.0.23.54770: Flags [.], seq 31468:32916, ack 622, win 501, options [nop,nop,TS val 1554418581 ecr 375345589], length 1448\
19:41:36.980193 IP a23-223-17-202.deploy.static.akamaitechnologies.com.https > 192.168.0.23.54770: Flags [P.], seq 32916:33394, ack 622, win 501, options [nop,nop,TS val 1554418581 ecr 375345589], length 478\
19:41:36.980194 IP a23-223-17-202.deploy.static.akamaitechnologies.com.https > 192.168.0.23.54770: Flags [.], seq 33394:34842, ack 622, win 501, options [nop,nop,TS val 1554418581 ecr 375345589], length 1448\
19:41:36.980195 IP a23-223-17-202.deploy.static.akamaitechnologies.com.https > 192.168.0.23.54770: Flags [.], seq 34842:36290, ack 622, win 501, options [nop,nop,TS val 1554418581 ecr 375345589], length 1448\
19:41:36.980196 IP a23-223-17-202.deploy.static.akamaitechnologies.com.https > 192.168.0.23.54770: Flags [.], seq 36290:37738, ack 622, win 501, options [nop,nop,TS val 1554418581 ecr 375345589], length 1448\
19:41:36.980197 IP a23-223-17-202.deploy.static.akamaitechnologies.com.https > 192.168.0.23.54770: Flags [.], seq 37738:39186, ack 622, win 501, options [nop,nop,TS val 1554418581 ecr 375345589], length 1448\
19:41:36.980198 IP a23-223-17-202.deploy.static.akamaitechnologies.com.https > 192.168.0.23.54770: Flags [.], seq 39186:40634, ack 622, win 501, options [nop,nop,TS val 1554418581 ecr 375345589], length 1448\
19:41:36.980199 IP a23-223-17-202.deploy.static.akamaitechnologies.com.https > 192.168.0.23.54770: Flags [.], seq 40634:42082, ack 622, win 501, options [nop,nop,TS val 1554418581 ecr 375345589], length 1448\
19:41:36.980201 IP a23-223-17-202.deploy.static.akamaitechnologies.com.https > 192.168.0.23.54770: Flags [.], seq 42082:43530, ack 622, win 501, options [nop,nop,TS val 1554418581 ecr 375345589], length 1448\
19:41:36.980202 IP a23-223-17-202.deploy.static.akamaitechnologies.com.https > 192.168.0.23.54770: Flags [.], seq 43530:44978, ack 622, win 501, options [nop,nop,TS val 1554418581 ecr 375345589], length 1448\
19:41:36.980203 IP a23-223-17-202.deploy.static.akamaitechnologies.com.https > 192.168.0.23.54770: Flags [.], seq 44978:46426, ack 622, win 501, options [nop,nop,TS val 1554418581 ecr 375345589], length 1448\
19:41:36.980283 IP 192.168.0.23.54770 > a23-223-17-202.deploy.static.akamaitechnologies.com.https: Flags [.], ack 42082, win 15525, options [nop,nop,TS val 375345607 ecr 1554418581], length 0\
19:41:36.980367 IP 192.168.0.23.54770 > a23-223-17-202.deploy.static.akamaitechnologies.com.https: Flags [.], ack 46426, win 15457, options [nop,nop,TS val 375345607 ecr 1554418581], length 0\
19:41:36.980522 IP 192.168.0.23.54770 > a23-223-17-202.deploy.static.akamaitechnologies.com.https: Flags [.], ack 46426, win 15758, options [nop,nop,TS val 375345607 ecr 1554418581], length 0\
19:41:36.981123 IP a23-223-17-202.deploy.static.akamaitechnologies.com.https > 192.168.0.23.54770: Flags [.], seq 46426:47874, ack 622, win 501, options [nop,nop,TS val 1554418581 ecr 375345589], length 1448\
19:41:36.981125 IP a23-223-17-202.deploy.static.akamaitechnologies.com.https > 192.168.0.23.54770: Flags [.], seq 47874:49322, ack 622, win 501, options [nop,nop,TS val 1554418581 ecr 375345589], length 1448\
19:41:36.981126 IP a23-223-17-202.deploy.static.akamaitechnologies.com.https > 192.168.0.23.54770: Flags [.], seq 49322:50770, ack 622, win 501, options [nop,nop,TS val 1554418581 ecr 375345589], length 1448\
19:41:36.981195 IP 192.168.0.23.54770 > a23-223-17-202.deploy.static.akamaitechnologies.com.https: Flags [.], ack 50770, win 15690, options [nop,nop,TS val 375345607 ecr 1554418581], length 0\
19:41:36.981284 IP 192.168.0.23.54770 > a23-223-17-202.deploy.static.akamaitechnologies.com.https: Flags [.], ack 50770, win 15758, options [nop,nop,TS val 375345608 ecr 1554418581], length 0\
19:41:36.982348 IP a23-223-17-202.deploy.static.akamaitechnologies.com.https > 192.168.0.23.54770: Flags [.], seq 50770:52218, ack 622, win 501, options [nop,nop,TS val 1554418581 ecr 375345589], length 1448\
19:41:36.982350 IP a23-223-17-202.deploy.static.akamaitechnologies.com.https > 192.168.0.23.54770: Flags [.], seq 52218:53666, ack 622, win 501, options [nop,nop,TS val 1554418581 ecr 375345589], length 1448\
19:41:36.982351 IP a23-223-17-202.deploy.static.akamaitechnologies.com.https > 192.168.0.23.54770: Flags [.], seq 53666:55114, ack 622, win 501, options [nop,nop,TS val 1554418581 ecr 375345589], length 1448\
19:41:36.982352 IP a23-223-17-202.deploy.static.akamaitechnologies.com.https > 192.168.0.23.54770: Flags [.], seq 55114:56562, ack 622, win 501, options [nop,nop,TS val 1554418581 ecr 375345589], length 1448\
19:41:36.982353 IP a23-223-17-202.deploy.static.akamaitechnologies.com.https > 192.168.0.23.54770: Flags [P.], seq 56562:56808, ack 622, win 501, options [nop,nop,TS val 1554418581 ecr 375345589], length 246\
19:41:36.982353 IP a23-223-17-202.deploy.static.akamaitechnologies.com.https > 192.168.0.23.54770: Flags [.], seq 56808:58256, ack 622, win 501, options [nop,nop,TS val 1554418582 ecr 375345589], length 1448\
19:41:36.982354 IP a23-223-17-202.deploy.static.akamaitechnologies.com.https > 192.168.0.23.54770: Flags [.], seq 58256:59704, ack 622, win 501, options [nop,nop,TS val 1554418582 ecr 375345589], length 1448\
19:41:36.982355 IP a23-223-17-202.deploy.static.akamaitechnologies.com.https > 192.168.0.23.54770: Flags [.], seq 59704:61152, ack 622, win 501, options [nop,nop,TS val 1554418582 ecr 375345589], length 1448\
19:41:36.982356 IP a23-223-17-202.deploy.static.akamaitechnologies.com.https > 192.168.0.23.54770: Flags [.], seq 61152:62600, ack 622, win 501, options [nop,nop,TS val 1554418582 ecr 375345589], length 1448\
19:41:36.982357 IP a23-223-17-202.deploy.static.akamaitechnologies.com.https > 192.168.0.23.54770: Flags [.], seq 62600:64048, ack 622, win 501, options [nop,nop,TS val 1554418582 ecr 375345589], length 1448\
19:41:36.982358 IP a23-223-17-202.deploy.static.akamaitechnologies.com.https > 192.168.0.23.54770: Flags [.], seq 64048:65496, ack 622, win 501, options [nop,nop,TS val 1554418582 ecr 375345589], length 1448\
19:41:36.982359 IP a23-223-17-202.deploy.static.akamaitechnologies.com.https > 192.168.0.23.54770: Flags [.], seq 65496:66944, ack 622, win 501, options [nop,nop,TS val 1554418582 ecr 375345589], length 1448\
19:41:36.982360 IP a23-223-17-202.deploy.static.akamaitechnologies.com.https > 192.168.0.23.54770: Flags [.], seq 66944:68392, ack 622, win 501, options [nop,nop,TS val 1554418582 ecr 375345589], length 1448\
19:41:36.982361 IP a23-223-17-202.deploy.static.akamaitechnologies.com.https > 192.168.0.23.54770: Flags [.], seq 68392:69840, ack 622, win 501, options [nop,nop,TS val 1554418582 ecr 375345589], length 1448\
19:41:36.982362 IP a23-223-17-202.deploy.static.akamaitechnologies.com.https > 192.168.0.23.54770: Flags [.], seq 69840:71288, ack 622, win 501, options [nop,nop,TS val 1554418582 ecr 375345589], length 1448\
19:41:36.982363 IP a23-223-17-202.deploy.static.akamaitechnologies.com.https > 192.168.0.23.54770: Flags [.], seq 71288:72736, ack 622, win 501, options [nop,nop,TS val 1554418582 ecr 375345589], length 1448\
19:41:36.982363 IP a23-223-17-202.deploy.static.akamaitechnologies.com.https > 192.168.0.23.54770: Flags [.], seq 72736:74184, ack 622, win 501, options [nop,nop,TS val 1554418582 ecr 375345589], length 1448\
19:41:36.982365 IP a23-223-17-202.deploy.static.akamaitechnologies.com.https > 192.168.0.23.54770: Flags [.], seq 74184:75632, ack 622, win 501, options [nop,nop,TS val 1554418582 ecr 375345589], length 1448\
19:41:36.982365 IP a23-223-17-202.deploy.static.akamaitechnologies.com.https > 192.168.0.23.54770: Flags [.], seq 75632:77080, ack 622, win 501, options [nop,nop,TS val 1554418582 ecr 375345589], length 1448\
19:41:36.982366 IP a23-223-17-202.deploy.static.akamaitechnologies.com.https > 192.168.0.23.54770: Flags [.], seq 77080:78528, ack 622, win 501, options [nop,nop,TS val 1554418582 ecr 375345589], length 1448\
19:41:36.982367 IP a23-223-17-202.deploy.static.akamaitechnologies.com.https > 192.168.0.23.54770: Flags [.], seq 78528:79976, ack 622, win 501, options [nop,nop,TS val 1554418582 ecr 375345589], length 1448\
19:41:36.982368 IP a23-223-17-202.deploy.static.akamaitechnologies.com.https > 192.168.0.23.54770: Flags [.], seq 79976:81424, ack 622, win 501, options [nop,nop,TS val 1554418582 ecr 375345589], length 1448\
19:41:36.982369 IP a23-223-17-202.deploy.static.akamaitechnologies.com.https > 192.168.0.23.54770: Flags [.], seq 81424:82872, ack 622, win 501, options [nop,nop,TS val 1554418582 ecr 375345589], length 1448\
19:41:36.982449 IP 192.168.0.23.54770 > a23-223-17-202.deploy.static.akamaitechnologies.com.https: Flags [.], ack 66944, win 15506, options [nop,nop,TS val 375345609 ecr 1554418582], length 0\
19:41:36.982500 IP 192.168.0.23.54770 > a23-223-17-202.deploy.static.akamaitechnologies.com.https: Flags [.], ack 82872, win 15257, options [nop,nop,TS val 375345609 ecr 1554418582], length 0\
19:41:36.982719 IP 192.168.0.23.54770 > a23-223-17-202.deploy.static.akamaitechnologies.com.https: Flags [.], ack 82872, win 15758, options [nop,nop,TS val 375345609 ecr 1554418582], length 0\
19:41:36.984474 IP a23-223-17-202.deploy.static.akamaitechnologies.com.https > 192.168.0.23.54770: Flags [.], seq 82872:84320, ack 622, win 501, options [nop,nop,TS val 1554418582 ecr 375345589], length 1448\
19:41:36.984476 IP a23-223-17-202.deploy.static.akamaitechnologies.com.https > 192.168.0.23.54770: Flags [.], seq 84320:85768, ack 622, win 501, options [nop,nop,TS val 1554418582 ecr 375345589], length 1448\
19:41:36.984477 IP a23-223-17-202.deploy.static.akamaitechnologies.com.https > 192.168.0.23.54770: Flags [.], seq 85768:87216, ack 622, win 501, options [nop,nop,TS val 1554418582 ecr 375345589], length 1448\
19:41:36.984477 IP a23-223-17-202.deploy.static.akamaitechnologies.com.https > 192.168.0.23.54770: Flags [.], seq 87216:88664, ack 622, win 501, options [nop,nop,TS val 1554418582 ecr 375345589], length 1448\
19:41:36.984478 IP a23-223-17-202.deploy.static.akamaitechnologies.com.https > 192.168.0.23.54770: Flags [.], seq 88664:90112, ack 622, win 501, options [nop,nop,TS val 1554418582 ecr 375345589], length 1448\
19:41:36.984479 IP a23-223-17-202.deploy.static.akamaitechnologies.com.https > 192.168.0.23.54770: Flags [.], seq 90112:91560, ack 622, win 501, options [nop,nop,TS val 1554418582 ecr 375345589], length 1448\
19:41:36.984480 IP a23-223-17-202.deploy.static.akamaitechnologies.com.https > 192.168.0.23.54770: Flags [.], seq 91560:93008, ack 622, win 501, options [nop,nop,TS val 1554418582 ecr 375345589], length 1448\
19:41:36.984481 IP a23-223-17-202.deploy.static.akamaitechnologies.com.https > 192.168.0.23.54770: Flags [.], seq 93008:94456, ack 622, win 501, options [nop,nop,TS val 1554418582 ecr 375345589], length 1448\
19:41:36.984482 IP a23-223-17-202.deploy.static.akamaitechnologies.com.https > 192.168.0.23.54770: Flags [.], seq 94456:95904, ack 622, win 501, options [nop,nop,TS val 1554418582 ecr 375345589], length 1448\
19:41:36.984483 IP a23-223-17-202.deploy.static.akamaitechnologies.com.https > 192.168.0.23.54770: Flags [.], seq 95904:97352, ack 622, win 501, options [nop,nop,TS val 1554418582 ecr 375345589], length 1448\
19:41:36.984484 IP a23-223-17-202.deploy.static.akamaitechnologies.com.https > 192.168.0.23.54770: Flags [.], seq 97352:98800, ack 622, win 501, options [nop,nop,TS val 1554418582 ecr 375345589], length 1448\
19:41:36.984485 IP a23-223-17-202.deploy.static.akamaitechnologies.com.https > 192.168.0.23.54770: Flags [.], seq 98800:100248, ack 622, win 501, options [nop,nop,TS val 1554418582 ecr 375345589], length 1448\
19:41:36.984487 IP a23-223-17-202.deploy.static.akamaitechnologies.com.https > 192.168.0.23.54770: Flags [P.], seq 100248:101592, ack 622, win 501, options [nop,nop,TS val 1554418582 ecr 375345589], length 1344\
19:41:36.984488 IP a23-223-17-202.deploy.static.akamaitechnologies.com.https > 192.168.0.23.54770: Flags [.], seq 101592:103040, ack 622, win 501, options [nop,nop,TS val 1554418583 ecr 375345589], length 1448\
19:41:36.984488 IP a23-223-17-202.deploy.static.akamaitechnologies.com.https > 192.168.0.23.54770: Flags [.], seq 103040:104488, ack 622, win 501, options [nop,nop,TS val 1554418583 ecr 375345589], length 1448\
19:41:36.984490 IP a23-223-17-202.deploy.static.akamaitechnologies.com.https > 192.168.0.23.54770: Flags [.], seq 104488:105936, ack 622, win 501, options [nop,nop,TS val 1554418583 ecr 375345589], length 1448\
19:41:36.984490 IP a23-223-17-202.deploy.static.akamaitechnologies.com.https > 192.168.0.23.54770: Flags [.], seq 105936:107384, ack 622, win 501, options [nop,nop,TS val 1554418583 ecr 375345589], length 1448\
19:41:36.984491 IP a23-223-17-202.deploy.static.akamaitechnologies.com.https > 192.168.0.23.54770: Flags [.], seq 107384:108832, ack 622, win 501, options [nop,nop,TS val 1554418583 ecr 375345589], length 1448\
19:41:36.984492 IP a23-223-17-202.deploy.static.akamaitechnologies.com.https > 192.168.0.23.54770: Flags [.], seq 108832:110280, ack 622, win 501, options [nop,nop,TS val 1554418583 ecr 375345589], length 1448\
19:41:36.984493 IP a23-223-17-202.deploy.static.akamaitechnologies.com.https > 192.168.0.23.54770: Flags [.], seq 110280:111728, ack 622, win 501, options [nop,nop,TS val 1554418583 ecr 375345589], length 1448\
19:41:36.984494 IP a23-223-17-202.deploy.static.akamaitechnologies.com.https > 192.168.0.23.54770: Flags [.], seq 111728:113176, ack 622, win 501, options [nop,nop,TS val 1554418583 ecr 375345589], length 1448\
19:41:36.984495 IP a23-223-17-202.deploy.static.akamaitechnologies.com.https > 192.168.0.23.54770: Flags [.], seq 113176:114624, ack 622, win 501, options [nop,nop,TS val 1554418583 ecr 375345589], length 1448\
19:41:36.984496 IP a23-223-17-202.deploy.static.akamaitechnologies.com.https > 192.168.0.23.54770: Flags [.], seq 114624:116072, ack 622, win 501, options [nop,nop,TS val 1554418583 ecr 375345589], length 1448\
19:41:36.984497 IP a23-223-17-202.deploy.static.akamaitechnologies.com.https > 192.168.0.23.54770: Flags [.], seq 116072:117520, ack 622, win 501, options [nop,nop,TS val 1554418583 ecr 375345589], length 1448\
19:41:36.984570 IP 192.168.0.23.54770 > a23-223-17-202.deploy.static.akamaitechnologies.com.https: Flags [.], ack 98800, win 15509, options [nop,nop,TS val 375345611 ecr 1554418582], length 0\
19:41:36.984590 IP 192.168.0.23.54770 > a23-223-17-202.deploy.static.akamaitechnologies.com.https: Flags [.], ack 114624, win 15262, options [nop,nop,TS val 375345611 ecr 1554418583], length 0\
19:41:36.984599 IP 192.168.0.23.54770 > a23-223-17-202.deploy.static.akamaitechnologies.com.https: Flags [.], ack 117520, win 15217, options [nop,nop,TS val 375345611 ecr 1554418583], length 0\
19:41:36.984748 IP 192.168.0.23.54770 > a23-223-17-202.deploy.static.akamaitechnologies.com.https: Flags [.], ack 117520, win 15758, options [nop,nop,TS val 375345611 ecr 1554418583], length 0\
19:41:36.985594 IP 192.168.0.23.50459 > dns-recursive.primus.ca.domain: 52621+ PTR? 202.17.223.23.in-addr.arpa. (44)\
19:41:36.986499 IP a23-223-17-202.deploy.static.akamaitechnologies.com.https > 192.168.0.23.54770: Flags [.], seq 117520:118968, ack 622, win 501, options [nop,nop,TS val 1554418583 ecr 375345589], length 1448\
19:41:36.986501 IP a23-223-17-202.deploy.static.akamaitechnologies.com.https > 192.168.0.23.54770: Flags [.], seq 118968:120416, ack 622, win 501, options [nop,nop,TS val 1554418583 ecr 375345589], length 1448\
19:41:36.986502 IP a23-223-17-202.deploy.static.akamaitechnologies.com.https > 192.168.0.23.54770: Flags [.], seq 120416:121864, ack 622, win 501, options [nop,nop,TS val 1554418583 ecr 375345589], length 1448\
19:41:36.986502 IP a23-223-17-202.deploy.static.akamaitechnologies.com.https > 192.168.0.23.54770: Flags [.], seq 121864:123312, ack 622, win 501, options [nop,nop,TS val 1554418583 ecr 375345589], length 1448\
19:41:36.986503 IP a23-223-17-202.deploy.static.akamaitechnologies.com.https > 192.168.0.23.54770: Flags [.], seq 123312:124760, ack 622, win 501, options [nop,nop,TS val 1554418583 ecr 375345589], length 1448\
19:41:36.986504 IP a23-223-17-202.deploy.static.akamaitechnologies.com.https > 192.168.0.23.54770: Flags [.], seq 124760:126208, ack 622, win 501, options [nop,nop,TS val 1554418583 ecr 375345589], length 1448\
19:41:36.986505 IP a23-223-17-202.deploy.static.akamaitechnologies.com.https > 192.168.0.23.54770: Flags [.], seq 126208:127656, ack 622, win 501, options [nop,nop,TS val 1554418583 ecr 375345589], length 1448\
19:41:36.986506 IP a23-223-17-202.deploy.static.akamaitechnologies.com.https > 192.168.0.23.54770: Flags [.], seq 127656:129104, ack 622, win 501, options [nop,nop,TS val 1554418583 ecr 375345589], length 1448\
19:41:36.986507 IP a23-223-17-202.deploy.static.akamaitechnologies.com.https > 192.168.0.23.54770: Flags [.], seq 129104:130552, ack 622, win 501, options [nop,nop,TS val 1554418583 ecr 375345589], length 1448\
19:41:36.986508 IP a23-223-17-202.deploy.static.akamaitechnologies.com.https > 192.168.0.23.54770: Flags [.], seq 130552:132000, ack 622, win 501, options [nop,nop,TS val 1554418583 ecr 375345589], length 1448\
19:41:36.986509 IP a23-223-17-202.deploy.static.akamaitechnologies.com.https > 192.168.0.23.54770: Flags [.], seq 132000:133448, ack 622, win 501, options [nop,nop,TS val 1554418583 ecr 375345589], length 1448\
19:41:36.986510 IP a23-223-17-202.deploy.static.akamaitechnologies.com.https > 192.168.0.23.54770: Flags [.], seq 133448:134896, ack 622, win 501, options [nop,nop,TS val 1554418583 ecr 375345589], length 1448\
19:41:36.986511 IP a23-223-17-202.deploy.static.akamaitechnologies.com.https > 192.168.0.23.54770: Flags [.], seq 134896:136344, ack 622, win 501, options [nop,nop,TS val 1554418583 ecr 375345589], length 1448\
19:41:36.986512 IP a23-223-17-202.deploy.static.akamaitechnologies.com.https > 192.168.0.23.54770: Flags [.], seq 136344:137792, ack 622, win 501, options [nop,nop,TS val 1554418583 ecr 375345589], length 1448\
19:41:36.986513 IP a23-223-17-202.deploy.static.akamaitechnologies.com.https > 192.168.0.23.54770: Flags [.], seq 137792:139240, ack 622, win 501, options [nop,nop,TS val 1554418583 ecr 375345589], length 1448\
19:41:36.986514 IP a23-223-17-202.deploy.static.akamaitechnologies.com.https > 192.168.0.23.54770: Flags [.], seq 139240:140688, ack 622, win 501, options [nop,nop,TS val 1554418583 ecr 375345589], length 1448\
19:41:36.986514 IP a23-223-17-202.deploy.static.akamaitechnologies.com.https > 192.168.0.23.54770: Flags [.], seq 140688:142136, ack 622, win 501, options [nop,nop,TS val 1554418583 ecr 375345589], length 1448\
19:41:36.986516 IP a23-223-17-202.deploy.static.akamaitechnologies.com.https > 192.168.0.23.54770: Flags [.], seq 142136:143584, ack 622, win 501, options [nop,nop,TS val 1554418583 ecr 375345589], length 1448\
19:41:36.986516 IP a23-223-17-202.deploy.static.akamaitechnologies.com.https > 192.168.0.23.54770: Flags [.], seq 143584:145032, ack 622, win 501, options [nop,nop,TS val 1554418583 ecr 375345589], length 1448\
19:41:36.986517 IP a23-223-17-202.deploy.static.akamaitechnologies.com.https > 192.168.0.23.54770: Flags [P.], seq 145032:146480, ack 622, win 501, options [nop,nop,TS val 1554418583 ecr 375345589], length 1448\
19:41:36.986518 IP a23-223-17-202.deploy.static.akamaitechnologies.com.https > 192.168.0.23.54770: Flags [.], seq 146480:147928, ack 622, win 501, options [nop,nop,TS val 1554418584 ecr 375345589], length 1448\
19:41:36.986519 IP a23-223-17-202.deploy.static.akamaitechnologies.com.https > 192.168.0.23.54770: Flags [.], seq 147928:149376, ack 622, win 501, options [nop,nop,TS val 1554418584 ecr 375345589], length 1448\
19:41:36.986520 IP a23-223-17-202.deploy.static.akamaitechnologies.com.https > 192.168.0.23.54770: Flags [.], seq 149376:150824, ack 622, win 501, options [nop,nop,TS val 1554418584 ecr 375345589], length 1448\
19:41:36.986521 IP a23-223-17-202.deploy.static.akamaitechnologies.com.https > 192.168.0.23.54770: Flags [.], seq 150824:152272, ack 622, win 501, options [nop,nop,TS val 1554418584 ecr 375345589], length 1448\
19:41:36.986522 IP a23-223-17-202.deploy.static.akamaitechnologies.com.https > 192.168.0.23.54770: Flags [.], seq 152272:153720, ack 622, win 501, options [nop,nop,TS val 1554418584 ecr 375345589], length 1448\
19:41:36.986523 IP a23-223-17-202.deploy.static.akamaitechnologies.com.https > 192.168.0.23.54770: Flags [.], seq 153720:155168, ack 622, win 501, options [nop,nop,TS val 1554418584 ecr 375345589], length 1448\
19:41:36.986524 IP a23-223-17-202.deploy.static.akamaitechnologies.com.https > 192.168.0.23.54770: Flags [.], seq 155168:156616, ack 622, win 501, options [nop,nop,TS val 1554418584 ecr 375345589], length 1448\
19:41:36.986524 IP a23-223-17-202.deploy.static.akamaitechnologies.com.https > 192.168.0.23.54770: Flags [.], seq 156616:158064, ack 622, win 501, options [nop,nop,TS val 1554418584 ecr 375345589], length 1448\
19:41:36.986573 IP 192.168.0.23.54770 > a23-223-17-202.deploy.static.akamaitechnologies.com.https: Flags [.], ack 133448, win 15509, options [nop,nop,TS val 375345613 ecr 1554418583], length 0\
19:41:36.986591 IP 192.168.0.23.54770 > a23-223-17-202.deploy.static.akamaitechnologies.com.https: Flags [.], ack 149376, win 15261, options [nop,nop,TS val 375345613 ecr 1554418584], length 0\
19:41:36.986600 IP 192.168.0.23.54770 > a23-223-17-202.deploy.static.akamaitechnologies.com.https: Flags [.], ack 158064, win 15125, options [nop,nop,TS val 375345613 ecr 1554418584], length 0\
19:41:36.986835 IP 192.168.0.23.54770 > a23-223-17-202.deploy.static.akamaitechnologies.com.https: Flags [.], ack 158064, win 15758, options [nop,nop,TS val 375345613 ecr 1554418584], length 0\
19:41:36.987288 IP a23-223-17-202.deploy.static.akamaitechnologies.com.https > 192.168.0.23.54770: Flags [.], seq 158064:159512, ack 622, win 501, options [nop,nop,TS val 1554418584 ecr 375345589], length 1448\
19:41:36.987289 IP a23-223-17-202.deploy.static.akamaitechnologies.com.https > 192.168.0.23.54770: Flags [.], seq 159512:160960, ack 622, win 501, options [nop,nop,TS val 1554418584 ecr 375345589], length 1448\
19:41:36.987290 IP a23-223-17-202.deploy.static.akamaitechnologies.com.https > 192.168.0.23.54770: Flags [.], seq 160960:162408, ack 622, win 501, options [nop,nop,TS val 1554418584 ecr 375345589], length 1448\
19:41:36.987291 IP a23-223-17-202.deploy.static.akamaitechnologies.com.https > 192.168.0.23.54770: Flags [.], seq 162408:163856, ack 622, win 501, options [nop,nop,TS val 1554418584 ecr 375345589], length 1448\
19:41:36.987319 IP 192.168.0.23.54770 > a23-223-17-202.deploy.static.akamaitechnologies.com.https: Flags [.], ack 163856, win 15668, options [nop,nop,TS val 375345613 ecr 1554418584], length 0\
19:41:36.987440 IP 192.168.0.23.54770 > a23-223-17-202.deploy.static.akamaitechnologies.com.https: Flags [.], ack 163856, win 15758, options [nop,nop,TS val 375345613 ecr 1554418584], length 0\
19:41:36.987942 IP a23-223-17-202.deploy.static.akamaitechnologies.com.https > 192.168.0.23.54770: Flags [.], seq 163856:165304, ack 622, win 501, options [nop,nop,TS val 1554418584 ecr 375345589], length 1448\
19:41:36.987944 IP a23-223-17-202.deploy.static.akamaitechnologies.com.https > 192.168.0.23.54770: Flags [.], seq 165304:166752, ack 622, win 501, options [nop,nop,TS val 1554418584 ecr 375345589], length 1448\
19:41:36.987997 IP 192.168.0.23.54770 > a23-223-17-202.deploy.static.akamaitechnologies.com.https: Flags [.], ack 166752, win 15758, options [nop,nop,TS val 375345614 ecr 1554418584], length 0\
19:41:36.989417 IP a23-223-17-202.deploy.static.akamaitechnologies.com.https > 192.168.0.23.54770: Flags [.], seq 166752:168200, ack 622, win 501, options [nop,nop,TS val 1554418584 ecr 375345589], length 1448\
19:41:36.989418 IP a23-223-17-202.deploy.static.akamaitechnologies.com.https > 192.168.0.23.54770: Flags [.], seq 168200:169648, ack 622, win 501, options [nop,nop,TS val 1554418584 ecr 375345589], length 1448\
19:41:36.989419 IP a23-223-17-202.deploy.static.akamaitechnologies.com.https > 192.168.0.23.54770: Flags [.], seq 169648:171096, ack 622, win 501, options [nop,nop,TS val 1554418584 ecr 375345589], length 1448\
19:41:36.989420 IP a23-223-17-202.deploy.static.akamaitechnologies.com.https > 192.168.0.23.54770: Flags [.], seq 171096:172544, ack 622, win 501, options [nop,nop,TS val 1554418584 ecr 375345589], length 1448\
19:41:36.989421 IP a23-223-17-202.deploy.static.akamaitechnologies.com.https > 192.168.0.23.54770: Flags [.], seq 172544:173992, ack 622, win 501, options [nop,nop,TS val 1554418584 ecr 375345589], length 1448\
19:41:36.989422 IP a23-223-17-202.deploy.static.akamaitechnologies.com.https > 192.168.0.23.54770: Flags [.], seq 173992:175440, ack 622, win 501, options [nop,nop,TS val 1554418584 ecr 375345589], length 1448\
19:41:36.989423 IP a23-223-17-202.deploy.static.akamaitechnologies.com.https > 192.168.0.23.54770: Flags [.], seq 175440:176888, ack 622, win 501, options [nop,nop,TS val 1554418584 ecr 375345589], length 1448\
19:41:36.989424 IP a23-223-17-202.deploy.static.akamaitechnologies.com.https > 192.168.0.23.54770: Flags [.], seq 176888:178336, ack 622, win 501, options [nop,nop,TS val 1554418584 ecr 375345589], length 1448\
19:41:36.989425 IP a23-223-17-202.deploy.static.akamaitechnologies.com.https > 192.168.0.23.54770: Flags [.], seq 178336:179784, ack 622, win 501, options [nop,nop,TS val 1554418584 ecr 375345589], length 1448\
19:41:36.989426 IP a23-223-17-202.deploy.static.akamaitechnologies.com.https > 192.168.0.23.54770: Flags [.], seq 179784:181232, ack 622, win 501, options [nop,nop,TS val 1554418584 ecr 375345589], length 1448\
19:41:36.989427 IP a23-223-17-202.deploy.static.akamaitechnologies.com.https > 192.168.0.23.54770: Flags [.], seq 181232:182680, ack 622, win 501, options [nop,nop,TS val 1554418584 ecr 375345589], length 1448\
19:41:36.989427 IP a23-223-17-202.deploy.static.akamaitechnologies.com.https > 192.168.0.23.54770: Flags [.], seq 182680:184128, ack 622, win 501, options [nop,nop,TS val 1554418584 ecr 375345589], length 1448\
19:41:36.989429 IP a23-223-17-202.deploy.static.akamaitechnologies.com.https > 192.168.0.23.54770: Flags [.], seq 184128:185576, ack 622, win 501, options [nop,nop,TS val 1554418584 ecr 375345589], length 1448\
19:41:36.989430 IP a23-223-17-202.deploy.static.akamaitechnologies.com.https > 192.168.0.23.54770: Flags [.], seq 185576:187024, ack 622, win 501, options [nop,nop,TS val 1554418584 ecr 375345589], length 1448\
19:41:36.989430 IP a23-223-17-202.deploy.static.akamaitechnologies.com.https > 192.168.0.23.54770: Flags [.], seq 187024:188472, ack 622, win 501, options [nop,nop,TS val 1554418584 ecr 375345589], length 1448\
19:41:36.989432 IP a23-223-17-202.deploy.static.akamaitechnologies.com.https > 192.168.0.23.54770: Flags [.], seq 188472:189920, ack 622, win 501, options [nop,nop,TS val 1554418584 ecr 375345589], length 1448\
19:41:36.989432 IP a23-223-17-202.deploy.static.akamaitechnologies.com.https > 192.168.0.23.54770: Flags [P.], seq 189920:191368, ack 622, win 501, options [nop,nop,TS val 1554418584 ecr 375345589], length 1448\
19:41:36.989433 IP a23-223-17-202.deploy.static.akamaitechnologies.com.https > 192.168.0.23.54770: Flags [.], seq 191368:192816, ack 622, win 501, options [nop,nop,TS val 1554418585 ecr 375345589], length 1448\
19:41:36.989434 IP a23-223-17-202.deploy.static.akamaitechnologies.com.https > 192.168.0.23.54770: Flags [.], seq 192816:194264, ack 622, win 501, options [nop,nop,TS val 1554418585 ecr 375345589], length 1448\
19:41:36.989435 IP a23-223-17-202.deploy.static.akamaitechnologies.com.https > 192.168.0.23.54770: Flags [.], seq 194264:195712, ack 622, win 501, options [nop,nop,TS val 1554418585 ecr 375345589], length 1448\
19:41:36.989590 IP 192.168.0.23.54770 > a23-223-17-202.deploy.static.akamaitechnologies.com.https: Flags [.], ack 195712, win 15758, options [nop,nop,TS val 375345616 ecr 1554418584], length 0\
19:41:36.990803 IP a23-223-17-202.deploy.static.akamaitechnologies.com.https > 192.168.0.23.54770: Flags [.], seq 195712:197160, ack 622, win 501, options [nop,nop,TS val 1554418585 ecr 375345589], length 1448\
19:41:36.990803 IP a23-223-17-202.deploy.static.akamaitechnologies.com.https > 192.168.0.23.54770: Flags [.], seq 197160:198608, ack 622, win 501, options [nop,nop,TS val 1554418585 ecr 375345589], length 1448\
19:41:36.990804 IP a23-223-17-202.deploy.static.akamaitechnologies.com.https > 192.168.0.23.54770: Flags [.], seq 198608:200056, ack 622, win 501, options [nop,nop,TS val 1554418585 ecr 375345589], length 1448\
19:41:36.990805 IP a23-223-17-202.deploy.static.akamaitechnologies.com.https > 192.168.0.23.54770: Flags [.], seq 200056:201504, ack 622, win 501, options [nop,nop,TS val 1554418585 ecr 375345589], length 1448\
19:41:36.990806 IP a23-223-17-202.deploy.static.akamaitechnologies.com.https > 192.168.0.23.54770: Flags [.], seq 201504:202952, ack 622, win 501, options [nop,nop,TS val 1554418585 ecr 375345589], length 1448\
19:41:36.990807 IP a23-223-17-202.deploy.static.akamaitechnologies.com.https > 192.168.0.23.54770: Flags [.], seq 202952:204400, ack 622, win 501, options [nop,nop,TS val 1554418585 ecr 375345589], length 1448\
19:41:36.990808 IP a23-223-17-202.deploy.static.akamaitechnologies.com.https > 192.168.0.23.54770: Flags [.], seq 204400:205848, ack 622, win 501, options [nop,nop,TS val 1554418585 ecr 375345589], length 1448\
19:41:36.990809 IP a23-223-17-202.deploy.static.akamaitechnologies.com.https > 192.168.0.23.54770: Flags [.], seq 205848:207296, ack 622, win 501, options [nop,nop,TS val 1554418585 ecr 375345589], length 1448\
19:41:36.990810 IP a23-223-17-202.deploy.static.akamaitechnologies.com.https > 192.168.0.23.54770: Flags [.], seq 207296:208744, ack 622, win 501, options [nop,nop,TS val 1554418585 ecr 375345589], length 1448\
19:41:36.990811 IP a23-223-17-202.deploy.static.akamaitechnologies.com.https > 192.168.0.23.54770: Flags [.], seq 208744:210192, ack 622, win 501, options [nop,nop,TS val 1554418585 ecr 375345589], length 1448\
19:41:36.990812 IP a23-223-17-202.deploy.static.akamaitechnologies.com.https > 192.168.0.23.54770: Flags [.], seq 210192:211640, ack 622, win 501, options [nop,nop,TS val 1554418585 ecr 375345589], length 1448\
19:41:36.990813 IP a23-223-17-202.deploy.static.akamaitechnologies.com.https > 192.168.0.23.54770: Flags [.], seq 211640:213088, ack 622, win 501, options [nop,nop,TS val 1554418585 ecr 375345589], length 1448\
19:41:36.990814 IP a23-223-17-202.deploy.static.akamaitechnologies.com.https > 192.168.0.23.54770: Flags [.], seq 213088:214536, ack 622, win 501, options [nop,nop,TS val 1554418585 ecr 375345589], length 1448\
19:41:36.990815 IP a23-223-17-202.deploy.static.akamaitechnologies.com.https > 192.168.0.23.54770: Flags [.], seq 214536:215984, ack 622, win 501, options [nop,nop,TS val 1554418585 ecr 375345589], length 1448\
19:41:36.990816 IP a23-223-17-202.deploy.static.akamaitechnologies.com.https > 192.168.0.23.54770: Flags [.], seq 215984:217432, ack 622, win 501, options [nop,nop,TS val 1554418585 ecr 375345589], length 1448\
19:41:36.990817 IP a23-223-17-202.deploy.static.akamaitechnologies.com.https > 192.168.0.23.54770: Flags [.], seq 217432:218880, ack 622, win 501, options [nop,nop,TS val 1554418585 ecr 375345589], length 1448\
19:41:36.990818 IP a23-223-17-202.deploy.static.akamaitechnologies.com.https > 192.168.0.23.54770: Flags [.], seq 218880:220328, ack 622, win 501, options [nop,nop,TS val 1554418585 ecr 375345589], length 1448\
19:41:36.990819 IP a23-223-17-202.deploy.static.akamaitechnologies.com.https > 192.168.0.23.54770: Flags [.], seq 220328:221776, ack 622, win 501, options [nop,nop,TS val 1554418585 ecr 375345589], length 1448\
19:41:36.990819 IP a23-223-17-202.deploy.static.akamaitechnologies.com.https > 192.168.0.23.54770: Flags [.], seq 221776:223224, ack 622, win 501, options [nop,nop,TS val 1554418585 ecr 375345589], length 1448\
19:41:36.991031 IP 192.168.0.23.54770 > a23-223-17-202.deploy.static.akamaitechnologies.com.https: Flags [.], ack 223224, win 15758, options [nop,nop,TS val 375345617 ecr 1554418585], length 0\
19:41:36.992198 IP a23-223-17-202.deploy.static.akamaitechnologies.com.https > 192.168.0.23.54770: Flags [.], seq 223224:224672, ack 622, win 501, options [nop,nop,TS val 1554418585 ecr 375345589], length 1448\
